Municipios,Nome do Conflito,Familias,Area
Tucurui/ Uruara/ Altamira/ Pacaja Rurdpolis/ Medicilandia,T. Sun Fazenda |. Cachoeira Mineradora/PAC Petropolis/Gleba Seca do Iriri/indios 11 Arara/UHE Belo Monte/Belo,,
Subtotal:,82,,10093705
Alhandra,Faz. Garapu/Acamp. D. José Maria Pires,,5000
Mogeiro,Fazenda Paraiso,,700
Patos Mogeiro,Area Fazenda da EMBRAPA/Acamp. Salgadinho Cicero Gregorio,,361
Pedras de Fogo,Mamoaba Agro Pastoril S/A/Acamp. Arcanjo Belarmino,,
Pilar,Fazenda Paraiso,,400
Sao José dos Ramos,Faz. Sao José/Pau-a-Pique,,1100
Subtotal:,11,,7561
Guaira,T. |. Guarani Mbya/Aldeia Tekoha Marangatu/Itaipu Binacional,,
Guaira,T. |. Guarani Mbya/Aldeia Tekoha Tatury/Mineradora,,
Quedas do Iguacu,Faz. Dona Hilda e Sta. Rita/Araupel,,2040
Quedas do Iguacu,Faz Rio das Cobras/Araupel/Acamp. Herdeiros da Terra 1° de,,35000
Santa Helena,Tekoha Curva Guarani /T.I. Ava Guarani/Itaipu Binacional,,
Santa Helena,Tekoha Mokoi Joegua-Ete Dois Irmaos-Pyau/Itaipu Binacional,,
SAo Miguel do Iguacu,T.I. Ava Guarani Mbya Ocoy/Res. Sta. Rosa do Ocui/UHE,,231
Subtotal:,13,,37271
Alianga,Engenho Belo Horizonte,,350
Cabo de Santo Agostinho,Eng. IIlha/Complexo Suape,,1000
Floresta/ Petrolandia,S. Francisco Estagao de Bombeamento 2 Eixo Leste/Agude Areias/Transp.,,
Ipojuca,Engenho Salgado/Us. Salgado,1,
Ipojuca,Com. Quil. Ilha de Mercés/Complexo Suape,479,
Jaboatao dos Guararapes Itaquitinga Ipojuca/ Escada,Engenho Suassuna Eng. Pocgos/Us. Santa Tereza Us. Salgado/Com. Sitio Zé Ipojuca,300 100 160,
Jaqueira Jaqueira,Eng. Eng. Caixa Fervedouro/Us. d' Agua/Varzea Frei Caneca Velha/Us. Frei Caneca,150 71,560
Jaqueira,Com. do Eng. Colénia II/Laranjeira/Us. Frei Caneca,48,207
Jaqueira,Eng. Colénia |/Barro Branco/Us. Frei Caneca,77,2000
Jatoba,Com. Caldeirao/T.|. Pankararu,75,
Jatoba,Com. Bem Querer de Baixo/T.I. Pankararu,75,
Jatoba,Com. Cacheado/T.|. Pankararu,75,
Jatoba,Com. Bem Querer de Cima/T.|. Pankararu,75,
Lajedo Lagoa dos Gatos/ Canhotinho,Faz. Riacho de Dentro/Riachao Faz. Mario/Acamp. Lula Livre XI,162 80,960
Orocoé Orocoé Orocoé Orocoé Orocoé Moreno,Com. Com. Com. Com. Com. Engenho Quil. Quil. Quil. Quil. Quil. Una/Us. Vitorino/Territ. Mata Caatinguinha/Territ. Remanso/Territ. Umburana/Territ. de Bulhées Sao Jodo/Territ. Aguas Aguas Aguas Aguas do do do Velho Aguas Velho do Velho Velho Chico do Chico Chico Velho Chico Chico,40 35 75,800
Paudalho,Eng. Planalto/Acamp. Lula Livre IV,100,
Petrolandia/ Tacaratu,T. |. Pankararu/Us. Eletronuclear,917,8100
Petrolina,Area no Proj. Pontal Sul,700,
Sao Joaquim do Monte,Faz. Jabuticaba/4 Irmaos,45,
Serra Talhada,Faz. Jatoba/Acamp. Lula Livre IX,157,
Sertania,Faz. Santa Luzia/Acamp. Fortaleza,30,
Sertania,Fazenda Jau,85,
Tamandaré,Engenho Canoinha,70,800
Timbatba Vitoria de Santo Antao,Eng. Jenipapo/Acamp. Lula Livre X Eng. Nova Cinta/Acamp. Lula Livre III,152 130,
Subtotal:,45,6061,14777
Baixa Grande do Ribeiro,Comunidade Morro d' Agua,8,1200
Baixa Grande do Ribeiro,Com. Brejo Seco/Santa Fé/Riozinho,82,
Bom Jesus,Comunidade Salto |,10,1000
Bom Jesus,Com. Salto do Santo Anténio,17,1221
Bom Jesus,Comunidade Salto II,16,
Bom Jesus/ Gilbués,Com. Correntina/Riacho Melancias/Morro dos Cavalos/Brejo d' Agua/Gata/Barra das Eguas/Serra do Partida/Assent. Rio Preto,41,
Bom Jesus/ Santa Filomena,Areas em Bom Jesus e Santa Filomena,96,
Curralinhos Palmeirais/ Nazaria,Area Fazenda Veneza Piquete,140 120,
Palmeirais/ Nazaria,Area Galiza,80,
Paulistana,Com. Quill. Contente/Transnordestina,47,
Santa Filomena Santa Filomena,Comunidade Baixao Fechado Sete Lagoas/Lagoa do Junco/Vao do Vico,24 10,
Santa Filomena,Area em Chupé/Grupo Pompeu/JAP,8,
Teresina,Acampamento Santa Teresa,80,
Teresina/ Altos,Fazenda Sao Joao,57,
Teresina/ Nazaria,Data Sao José do Junco/Chapadinha,200,1860
Subtotal:,19,1036,5281
Angra Campos dos dos Reis Goytacazes/ Sao Joao da Barra Parati Mangaratiba,APA de Cairugu/Com. Caigara Praia do Sono/Ponta Negra Com. Fazenda Agua Bracui Preta/Complexo Portuario Acu/Minas-Rio/PAC Faz. Santa Justina/Acamp. Olga Benario,200 15 57,33800 850
Parati,Serra de Bocaina Com. Tradicionais Caigaras/Trindade/Cajaiba/Pq. Nac. da,23,
Rio das Ostras,Uniao Faz. Montes Verdes/Rancho Sagitario/Reserva Biolégica,200,
Rio de Janeiro,Comunidade Quilombola da Vila Sacopa,8,
Rio de Janeiro,Quilombo Pedra do Sal,25,
Subtotal:,8,528,34650
Afonso Bezerra,Area do Estado/Acamp. Antonio Batista,100,
Macaiba,Acamp. Independéncia Camponesa/ Barragem de Tabatinga,50,
Subtotal:,2,150,
Canela Marau Encruzilhada do Sul,T. Area Area |. Kaingang/Floresta da do DNIT Fepagro Nacional de Canela,,350
Porto Alegre,Faz. Ponta do Arado/T.| Guarani Mbya,,426
Subtotal:,6,,1156
Alta Floresta do Oeste/ Sao Francisco do Guaporé,T. | Rio Branco/Aldeia Anderé,,236000
Alta Floresta do Oeste/ Sao Francisco do Guaporé,T. |. Massaco,,422000
Alvorada do Oeste,Faz. do Italiano/Verde Vale,,3000
Ariquemes,Faz. Arroba/S6 Cacau/Acamp. Canaa,,3600
Buritis/ Nova Mamoré,Fazenda Schumann,300,10500
Cabixi,Acampamento Igarapé Preto,120,
Cacoal,T. |. Sete de Setembro,345,248000
Campo Novo de Rondénia/ Seringueiras/ Monte Ne,T. |. Uru-Eu-Wau-Wau,115,
Candeias do Jamari,Linha Rio Preto,100,
Chupinguaia/ Vilhena,Corumbiara/Assoc. Faz. Estrela/Pai Herdi/Lotes Nossa Sra. 52 Aparecida e 53/Linhas 80 e 85/GI.,40,
Corumbiara,Assentamento Roncauto,40,
Costa Marques,Reserva Extrativista do Rio Cautario/T. |. Cojubim,150,
Costa Marques,Com. Quilombola do Forte Principe da Beira,60,
Costa Marques,Com. Quilombola de Santa Fé,12,1452
Espigao do Oeste/ Vilhena,Reserva Indigena Roosevelt,240,
Guajara-Mirim,T. |. Sagarana,85,18000
Guajara-Mirim/ Nova Mamoré,T. |. Igarapé Lage,120,
Guajara-Mirim/ Itapua do Oeste Nova Mamoré,T. Faz. |. Igarapé Agua Azul/Acamp. Ribeirao/Aldeia Raio Ribeirao de Sol II/Gl. Cajueiro/Lotes 01 02 e,50 50,200
Ji-Parana,Chacara em Ji-Parana,26,
Ji-Parana,T. |. Igarapé Lourdes,246,186000
Labrea (AM)/Porto Velho (RO),T. |. Kaxarari,70,10223
Machadinho D Oeste,Resex Rio Preto Jacunda,24,
Mirante da Serra,Faz. na Linha 70/Area Revolucionaria Paulo Bento,60,
Nova Mamoré,Acamp. Conquista/Faz. Primavera/Gleba Buriti/Distrito de,35,
Nova Mamoré,Acamp. Dois Irmaos/Dois Amigos/Faz. do Bispo/Linha 29 C,105,
Nova Uniao/ Mirante da Serra,Assent. Margarida Alves/Palmares e Pe. Ezequiel,200,11000
Ouro Preto do Oeste/ Vale do Paraiso,204/Acamp. Monte Cristo Faz. Triangulo/Trianon/Acamp. Jati/Terra Nossa/Lote,400,11000
Porto Velho,Faz. Kamias/Gleba do Japonés/Acamp. Frutos da Terra,,
Porto Velho/ Alto Paraiso,Acamp. Nova Esperanga/Boa Esperang¢a/Titulo Definitivo Sao Sebastiao/Flona Bom Futuro,419,
Porto Velho/ Campo Novo de Rondénia/ Nova Ma,Resex Jaci-Parana,,191234
Porto Velho/ Guajara-Mirim/ Nova Mamoré,T. |. Karipuna,,152930
Rio Crespo,"Acamp. 15, 16/GI. Bacuri/Linha 01 105/C-95/Km 30/GI. Burareiro/Lotes 14,",,
Sao Miguel do Guaporé,Com. Quilombola do Senhor Jesus,,5627
Seringueiras,Faz. Bom Futuro/Acamp. Enilson Ribeiro,,11000
Seringueiras,Faz. Riacho Doce/Acamp. Paulo Freire 4,,2480
Vilhena,Assoc. Iqué Vitéria/Lotes 435/436/437/438/439/455,24,
Vilhena,Gl. Corumbiara/Setor 12/Lote 52/Faz. Duarte/Assoc.,50,
Vilhena,Lote 33 C/Assoc. dos Produtores Rurais Dois Coragées,32,684
Subtotal:,52,4997,1524930
Alto Alegre,T.I. Macuxi e Wapixana/ Reserva Boqueirao,116,
Amajari,T.I| Anaro/Maloca do Anaro,11,
Boa Vista,T. |. Anzol/Faz. Sao Jorge,14,
Bonfim,T.I. Wapixana/ Reserva Moskow,157,
Bonfim,T. |. Macuxi e Wapixana/ Reserva Canauanim,245,11182
Canta,T.I. Wapixana/ Maloca Recanto da Saudade (NS),,
Canta/ Bonfim,T.I. Wapixana/ Reserva Muriru,46,
Caracarai/ Bonfim,T.I. Wapixana/ Reserva Jacamim,365,
Caroebe/ Mucajai/ Pacaraima Alto Sao Alegre/ Jodo da Caracarai Baliza,T. T.I. T.I. |. Trombetas-Mapuera/ Manoa-Pium/Wapixana/Macuxi Yanomami/Apiaui/Papiu/Y Wai Wai/ awaripé Hixcariana,1142 567 131,9644975 43000
Pacaraima,T. |. SAo Marcos/Macuxi/Wapixana/Taurepang,1460,654000
Sao Luis/ Sao Joao da Baliza,T. |. Waimiri Atroari,502,
Uiramuta/ Normandia/ Pacaraima,T. |. Raposa Serra do Sol/Jawari/Brilho do Sol/S. Miguel,3800,1678800
Subtotal:,14,8556,12031957
Abelardo Luz,Faz. Papua/ltalia Il/Acamp. Kide,62,1700
Abelardo Luz/ lpuacgu/ Xanxeré/ Entre Rios,T. |. Xapecd/Kaingang,1334,660
Balneario Camboriu,Com. Quilombola Morro do Boi,11,
Calmon,Faz. Pinhal/Pinhalao/Acamp. Maria Marta,120,2000
Campos Novos/ Monte Carlo,Com. Quilombola Invernada dos Negros,170,8000
Floriandépolis,Com. Quilombola Vidal Martins,28,
Fraiburgo,Fazenda Agroceres,80,600
Garopaba,Com. Quilombola Aldeia,34,
Monte Carlo,Com. Quilombola Campo dos Poli,12,
Paulo Lopes,Com. Quilombola Toca de Santa Cruz,38,
Xanxeré/ Faxinal dos Guedes,Chiarelo Faz. Chapecozinho II/Prezzotto Sementes/Acamp. Marcelino,400,1067
Subtotal:,20,2289,14027
Agudos,Faz. Tangara/Marrua,500,750
Aragatuba Araraquara,Acamp. Fazenda Encontro Santa Cecilia das Aguas,75 30,1680
Araraquara,Acamp. Novo Horizonte,270,
Bauru,Fazenda Paiva,250,
Castilho Boa Esperanga do Sul,Area Fazenda em Castilho Cachoeirnha,130 40,
Dracena,Faz. Espinheiro Preto,12,
Duartina,Fazenda Esmeralda,350,1500
Galia,Faz. Rio Vermelho,150,1200
Galia,Faz. Paraiso/Vitdria/Assent. Luiz Beltrame,77,
laras/ Tieté,Faz. Capivara/Faz. Sao Domingos do Tupa/Acamp. Anita,86,8000
Iporanga,Com. Galvao/Vale do Ribeira,33,
Limeira Itaporanga,Area Faz. Lageado/Acamp. do Horto Florestal lzael de Limeira Fagundes,108 25,2000 400
Limeira/ Americana,Usina Ester/Acamp. Roseli Nunes,789,
Mirante do Paranapanema,Fazenda Santa Cruz,100,900
Mogi-Guagu,Fazenda Campininha,250,4500
Pederneiras/ Bauru,Aymorés/Sitio Sta. Marina Horto Florestal Aymorés/Acamp.Terra Nossai/P. A.,80,5262
Pindamonhangaba,Area da Agéncia de Tecnologia do Agronegécio - APTA,250,
Ribeirao Preto,Faz. Sta. Lydia/Soc. Agricola Santa Elydia,50,
Riversul,Fazenda Can-Can,,600
Sao Carlos,Faz. Canchim/Embrapa,50,
Taubaté Serrana,Area Faz. Martindpolis/Usina Publica no Km 119 Nova da Via Uniao Dutra,200 170,
Taubaté,Fazenda Santana,70,300
Taubaté,Faz. Santa Rita/Acamp. Andrea Guaraciane,70,
Teodoro Sampaio,Fazenda Santa Cecilia,300,456
Valinhos,Faz. Eldorado/Acamp. Marielle Vive,500,1000
Subtotal:,30,5015,28548
Subtotal:,5,,
Araguaina/ Babaculandia/ Filadélfia,Faz. Boa Esperanca/ltaparica/Agua Viva/Acamp. na TO-222,,
Ipueiras,Faz. Pantano do Papagaio/Acamp. Clodomir Santos de Morais,,2070
Palmeirante,Faz. Recreio/Freitas/Acamp. Bom Jesus/Gabriel Filho,,975
Pequizeiro/ Couto Magalhaes,Fazenda Morrinhos e Jacu,,2884
Santa Tereza do Tocantins,Comunidade Quilombola Barra do Aroeira,174,
Sao Félix do Tocantins,Comunidade Quilombola do Rio do Prata,78,
Tocantinopolis/ Maurilandia do Tocantins,T. |. Apinajé/Apinayés/UHE Serra Quebrada/PAC,227,
Subtotal:,25,1574,81192
Total:,868,118080,39425490
