Municipios,Nome do Conflito,Familias,Area
Acrelandia,Ramal Campo Novo,45,
Acrelandia,Faz. do Senhor Viana/Ramal da 7/Estrada AC-475/GI. Porto,28,
Acrelandia,Faz. do Zé Capim/BR-364/Km 105,40,1800
Acrelandia,Ocupagao do Baiano,38,
Acrelandia,Faz. Grauna/BR-364,80,2000
Acrelandia,Fazenda Canaa,72,
Acrelandia,Fazenda Jéssica,72,
Acrelandia,Fazenda Zé Juina,50,
Acrelandia,Faz. da Rondobras/BR-364/Km 105/Gleba Porto Luiz,12,14000
Acrelandia,Seringal Fortaleza,60,
Acrelandia,Fazenda do Dr. Roberto,60,2000
Acrelandia,Seringal Porto Dias,80,
Acrelandia,Faz. Sara/Gleba Porto Luiz,30,
Acrelandia,Seringal Triunfo/Ramal do Pelé,129,5200
Acrelandia,Faz. Girassol/Ocup. do Brito,14,
Boca do Acre/Rio Branco,Faz. Uniao/Cruzeirinho,214,2000
Boca do Acre/Rio Branco,Seringal Cameta,30,
Boca do Acre/Rio Branco,Ocup. do Vinha/Ramal Sao Francisco/Km 60,25,
Boca do Acre/Rio Branco,Faz. Palotina/Seringal Novo Natal,160,
Boca do Acre/Rio Branco,Gl. Novo Axioma Redengao/Km 90/Ramal Sta. Helena,28,1350
Boca do Acre/Rio Branco,Seringal Entre Rios/Ramal do 52,39,122000
Boca do Acre/Rio Branco,Seringal Europa,30,
Boca do Acre/Rio Branco,Seringal Entre Rios/Ramal do 64,15,
Boca do Acre/Rio Branco,Gl. Novo Axioma Redengao/Ramal do Km 104,33,
Boca do Acre/Rio Branco,Ramal do 37/Seringal Entre Rios/Recreio do Sto. Anténio/GI.,31,
Boca do Acre/Rio Branco,Ramal do Garrafa,60,
Boca do Acre/Rio Branco,Seringal Bananeira,26,
Boca do Acre/Rio Branco,Seringal Andarai,120,
Boca do Acre/Rio Branco,Seringal Perseveranca,25,
Boca do Acre/Rio Branco,Seringal Codd/PAE Antimary,23,260000
Boca do Acre/Rio Branco,Seringal Pirapora,322,5000
Boca do Acre/Rio Branco,Seringal Macapa,114,5302
Boca do Acre/Rio Branco,Seringal Bom Lugar/Com. Nova Vida,,56000
Boca do Acre/Rio Branco,Seringal Novo Axioma Redengao/Ocup. do Diva,,47000
Boca do Acre/Rio Branco,Seringal Entre Rios/Ramal Sao Francisco/Faz. do Km 60/Faz.,,
Boca do Acre/Rio Branco,Seringal Igarapé Grande,,380
Boca do Acre/Rio Branco,Seringal Porto Central,,13600
Bujari,Faz. Canary/Ramal do Cacau,,15800
Cruzeiro do Sul,Comunidade Socd,,1500
Rio Branco,Seringal Cachoeira,,10780
Rio Branco,Seringal Sao Bernardo,,60000
Senador Guiomard/ Capixaba,Seringal Capatara,,44420
Subtotal:,56,,670132
Alagoas Traipu Sao Miguel dos Campos Sao Miguel dos Campos Rio Largo Subtotal:,Acamp. Rosaldo Augusto/Faz. Varzea Grande/Us. Utinga Fazenda Raio do Sol Faz. Giritana/Usina Sinimbu Faz. Santa Cruz/Usina Sinimbu 4,310 100 180 20 10,500 536 17 19
Amapa Amapa Amapa Amapa Amapa Amapa Cutias Calgoene Calcoene Calcgoene do Araguari Ferreira Gomes Ferreira Gomes,Alta Juncal Cunani Ramal Floresta/Gurupora Ilha e 7 Grande Ilhas Sao Roque/Redondo Com. ao Longo do Rio Laranjeiras/Amapa Grande/Piquia Ramal do Triunfo Faz. Minerva/CAPAB Igarapé do Palha/Amcel Faz. ltapoa/Amcel/Piquia Base Aérea/Localidade Proxima ao Cruzeiro,20 40 30 30 30 34 15 15 15 10 1,45000 37511 30000 16000 3000 1000 14400 2500 3600 500 700
Itaubal Itaubal do do Piririm Piririm,Areas Com. Quil. em lItaubal/Agronegocio Sao Miguel do Macacoari Sinal Verde/Boa Vista da Pedreira,20 20,2000 700
Macapa Macapa Macapa Macapa Macapa,Abacate do Pedreira/Rio Fugido ao Rio Pacui Santo Antdénio da Pedreira Com. Casa Grande/Porto Norte/APA Curiau Santa Luzia/Sa0 Tomé/Rio Pacui/10 Comunidades Proximas Recanto das Araras/Km 32-BR-156,200 20 20 30 50,3000 280 800 338 500
Macapa Macapa Macapa Macapa Macapa Macapa Mazagao Porto Grande Pedra Mazagao Mazagao Branca do Amapari Macapa Macapa/ Mazagao Itaubal do Piririm,Ariri Piririm/Pacui Quilombo Porto Bailique-Foz do Céu do Ambé Jupati Assentamento Quilombo Conceigao Pancada do do Macacoari Camaipi Assentamento Centro Piquiazal Novo Extrativista do Maraca Assent. Osmar Ribeiro/Ramal do Abacate/Km 34/EFA Km 117 da EFA P. A. Anauerapucu,100 20 20 50 30 100 23 5 20 15 6 80 30 10,20000 1200 500 2300 2800 3000 1500 30 2000 3000 8475 635 300 3000
Porto Porto Grande Grande Porto Grande,Area Sitio Sao da Codepa/Km Francisco/Igarapé 92 Gravata P. A. Nova Canaa,22 2 1,2700 150 3169
Santana Serra do Navio Serra do Navio,Assentamento Silvestre Ramal da Raquel Pau Furado/Matapi/MMX,20 12 15,2000 640 600
Tartarugalzinho Tartarugalzinho Tartarugalzinho Tartarugalzinho Tartarugalzinho Tartarugalzinho Tartarugalzinho Tartarugalzinho Subtotal:,Assentamento Agroextrativista do Tartarugal Grande Area Campo na Belo Margem Direita do Rio Itaubal/SAo Raimundo Redengao do Araguari Ponta Ramal Uapezal do do Socorro Ariramba e Vareiro Faz. Novo Horizonte/Amcel 46,1285 20 20 50 2 1 5 5 1,237975 10744 2261 2000 500 1192 1200 100 150
Autazes,Aldeia Sao Félix,120,
Boca do Acre Barcelos/ Santa Isabel do Rio Negro,T.I. Jurubaxi-Téa Aldeia Sao Paulino/Paolino,226 23,1208 8
Boca do Acre,T. |. Camicua,113,59000
Canutama Boca do Acre,Resex Arapixi Floresta Nac. Balata Tufari/Rio Mucuim/Com. Lua Nova e,300 16,133637
Canutama,Floresta Estadual/Com. Vila Souza,17,
Canutama,Km 46/BR-319/P. A. Sao Francisco/Linha 4/Vicinal Cajui,65,
Canutama,Resex/Com. Nova Vista,15,
Canutama Fonte Boa/ Tonantins/ Japura,T. Gleba | Mapari/indios C-1/Igarapé Kaixana Araras,316 36,157416 9000
lranduba lranduba/ Manacapuru/ Novo Airao,Gleba Ramal Igarapé do Agua do Branca/Ramal Bode do Acajatuba/14 Comunidades,468 120,
Jutai/ Atalaia do Norte/ Benjamin Constant/ Sao Pa,T. |. Vale do Javari,,8527000
Labrea/ Boca do Acre,T. |. Apurina Km 124 BR-317,,42000
Nova Olinda do Norte,Aldeias no PAE Abacaxis/Pilao e Terra Preta/Povo Maragua,,
Parintins,P. A. Gleba Vila Amazénia,,78270
Presidente Figueiredo/ Itacoatiara/ Novo Airao/ Uru,T. |. Waimiri Atroari/Linhao de Tucurui/PAC,,2585910
Tefé,T. |. Porto Praia,,5000
Subtotal:,42,,11598449
Andorinha,Comunidade Surara,180,217
Baiandpolis/ Santana/ Serra Dourada/ Tabocas do,Larga da Porteira Santa Cruz/Luiz Martins/Torrada/Cachoeira/Cercado,,18000
Barra,Fazenda Encosta,,3700
Barra,Comunidade Ribeirao,,600
Barra do Choga,Estancia Temaki/Acamp. Marcio Matos,230,
Bom Jesus da Lapa,Com. Quilombola Bebedouro/Fiol,,5000
Bom Jesus da Lapa,Com. Quil. Araga-Volta/Fiol,152,5000
Bom Jesus da Lapa,Quilombo Lagoa das Piranhas,220,10000
Cachoeira,Com. Quilombola Sao Francisco do Paraguagu,300,7000
Caetité,Com. Curral Velho/Fiol,80,
Caetité,Com. Quilombola Lagoa de Fora,35,
Caetité,Com. Serragem/Fiol,120,
Camacan,Faz. Conjunto Estrela Dalva,20,
Campo Alegre de Lourdes,8 Comunidades de Angico dos Dias,1800,
Candeias,Fazenda Beira Mar/Beira Rio,100,700
Caravelas,Fazenda Bambuzal,200,1300
Carinhanha/ Serra do Ramalho,Vista/Fiol PAE S@o Francisco/Com. Capao Preto/Caldeirao/Boa,200,20820
Casa Chorrocho Nova,Faz. Fazenda Sao Pedra Fancisco/Acamp. de Agua Eldorado dos Carajas,60,
Correntina,Fecho de Pasto de Porcos Guara e Pombas/Com.,53,8031
Correntina,Fecho de Pasto Capao do Modesto,50,8000
Correntina,Fecho de Pasto da Vereda da Felicidade/Com. Silvania/Sao,42,12000
Cotegipe,Fazenda Macambira,60,12000
Eunapolis,Fazenda Primavera,90,
Eunapolis,Fazenda Alianga,150,1000
Feira de Santana,Fazenda Havana,280,
Formosa do Rio Preto,Com. Cacimbinha/Condominio Estrondo,27,
Formosa do Rio Preto,Com. Baixa Funda/Condominio Estrondo,10,
Formosa do Rio Preto,Com. Cachoeira/Condominio Estrondo,12,50000
Formosa do Rio Preto,Com. Brejo do Tatu/Condominio Estrondo,12,
lramaia,Assentamento Boa Sorte,,17387
Itabuna/ Pau Brasil/ Itambé/ Itapetinga/ Itaju do Col,T. |. Caramuru Catarina Paraguassu,,54000
Itaguagu da Bahia/ Xique-Xique,Atingidas/PAC Projeto de Irrigagao Baixio do lrecé/18 Comunidades,,124000
Juazeiro,Comunidade Cachoeirinha,,1400
Lauro de Freitas,Com. Quilombola Quingoma,,1284
Mata de Sao Joao,Com. Quilombolas Tapera e Pau Grande,,600
Medeiros Neto,Fazenda Copacabana,,60000
Mirangaba,Com. Mangabeira/Fundo de Pasto da COMTRAFP,,700
Mirangaba,Com. Umbiguda/Fundo de Pasto da COMTRAFP,,700
Mirangaba,Com. Paranazinho/Fundo de Pasto da COMTRAFP,,700
Mirangaba,Com. Riacho/Fundo de Pasto da COMTRAFP,,500
Nova Vigosa,Fazenda Caravela,190,1377
Nova Vigosa,Fazenda Reunidas Campo do P6é,,3763
Rodelas Ribeirao do Largo,Area Faz. Conjunto Indigena Sao Tuxa/Aldeia Francisco/Faz. Mae do Deputado,220,
Santa Rita de Cassia,Assentamento Arco Verde,60,
Santo Amaro,Faz. Bela Vista/Boa Sorte/Acamp. Marcio Matos,150,
Sento Sento Sé Sé,Area Comunidade da Fruticultura Brejo de Frutimag/Acamp. Dentro Marcio Matos,160 100,
Simées Filho,Com. Quilombola Rio dos Macacos,43,
Taperoa,Com. Quilombola de Graciosa,154,
Teixeira de Freitas,Faz. Céu Azul/Suzano Papel Celulose,250,
Subtotal:,86,11009,
Aquiraz Crateus,T. Area |. Lagoa do DNOCS Encantada/Emp. Ypioca,200 80,
Lavras da Mangabeira,Sitio SAo Domingos/Acamp. Zé Wilson,100,996
Limoeiro do Norte,Com. Tomé/Proj. Irrigado Jaguaribe,625,
Limoeiro do Norte/ Jaguaribe/ Jaguaruana/ Alto Sa,Proj. de Irrig. Jaguaribe-Apodi/PAC/Acamp. Zé Maria do Tomé,150,
Mauriti,Faz. Gravata/Acamp. Vida Nova,30,1000
Pacatuba/ Maracanau,T. |. Pitaguary/Emp. Britaboa,1150,1735
Quixeramobim,Fazenda Serrote/Acamp. Joel do Nascimento,80,3700
Santana do Acarau,Faz. Canafistula/Acamp. 17 de Abril,30,1048
Tamboril,Cacimba dos Mocgos/Faz. Timbd6/Acamp. Comuna Irma,150,900
Subtotal:,10,2595,9379
Brazlandia,Nucleo Rural Alexandre Gusmao/Faz. Jatobazinho/Acamp.,200,430
Sobradinho,Faz. Savia/Salvia,75,306
Subtotal:,2,275,736
Conceigao da Barra,Faz. ltaunas/Agrop. Alianga S/A,200,
Fundao,Acamp. Marielle Franco/Fibria,100,80
Subtotal:,2,300,80
Cavalcante/ Monte Alegre de Goias,Com. Engenho II/Quilombo Kalunga,250,
Cavalcante/ Monte Alegre de Goias,Com. Vao de Almas/Hidrelétrica Santa M6nica/Kalunga,600,250000
Cidade Ocidental,Com. Quilombola de Mesquita,750,
Formosa,Acamp. Antonio Nascimento/Rio Parana,200,1600
Jussara/ Fazenda Nova,Fazenda Coqueiral,48,
Planaltina,Faz. Itauna/Empresa Igarashi/Corrego Lapinha,3,4030
Subtotal:,7,1851,255630
Agailandia,Assent. Novo Oriente/Vale,40,1367
Agailandia,Com. Francisco Romao/Vale,102,
Agailandia,Faz. Conquista/Assent. Joao do Vale/Vale,39,4170
Alcantara,Com. Quil. Mamuna/Mamona/Base Espacial,71,
Alcantara,Com. Quilombola Baracatatiua/Base Espacial,26,
Alcantara,Com. Quilombola Brito/Base Espacial,22,
Alcantara,Com. Quilombola ltapera/Base Espacial,19,
Alcantara,Com. Quilombola Manuninha/Base Espacial,56,
Aldeias Alcantara Altas,"Agroindustria Com. Pov. Gostoso, Quilombola Barro Ponte | e Il, do Pati, Murio/Base Bom Sucesso/TG Espacial",37,997
Alto Alegre do Maranhao,Boa Hora,41,1100
Alto Alegre do Maranhao,Arame,16,333
Alto Alegre do Maranhao,Com. Quilombola Mamorana/Boa Hora 3,32,900
Alto Alegre do Maranhao,Gl. Campo do Bandeira/Cia. Caxuxa Pastoril,45,1450
Alto Alegre do Pindaré,Comunidade Auzilandia/Vale,2000,
Anajatuba,Com. Capotal/Vale,14,
Anajatuba,Retiro Sao Joao da Mata/Vale,80,
Arari,Pov. Bubasa/Vale,110,
Arari,Cedro/Bufalos,,500
Balsas,P. A. Gado Bravinho,,2029
Balsas,Vargem,,400
Belagua,Estiva do Alfredo,13,360
Belagua,Pau Ferrado |,32,1800
Belagua,Pau Ferrado II,12,1800
Benedito Leite,"Forquilha I, Il e IIl/Regiao do Matopiba/II|ha Veneza",105,3200
Bom Jardim/ Mongao,T. |. Rio Pindaré/Aldeia Januaria/Tabocal,,15225
Bom Jardim/ Sao Joao do Caru,T. |. Caru,100,173000
Bom Jesus das Selvas,Assentamento Sao Francisco,70,4000
Bom Jesus das Selvas,Com. Nova Vida/Vale,175,
Buriti,Povoado Carrancas,,400
Buriti,Comunidade Brejao,,600
Buriticupu,Com. Vila Pindaré/Pov. Presa de Porco/Vale,800,
Buritirana/ Buriticupu/ Bom Jesus das Selvas/ Ara,"T. |. Arariboia/92 Aldeias/Etnias Guajajara, Gavido e Guaja",1329,413000
Caxias,Com. Sabia/Faz. Barra da Teresa,,4112
Caxias,Pov. Central dos Medeiros/Grupo Marata,,1300
Cedral,Engole,,475
Chapadinha,Tiuba,,900
Chapadinha,Vila Chapéu/P. A. Mangueira,,3158
Chapadinha,Acampamento Baturité,100,3200
Codo,Comunidade S4o Crist6vao,,400
Codo,Com. Trés Irmaos/Empresa Costa Pinto,,3500
Codo,Cocal/Empresa Costa Pinto/TG Agroindustria Ltda,,1500
Codo,Com. Morada Nova e Maraja/T. Q. Santa Maria dos Moreiras,,
Codo,Com. Quilombola Cipoal dos Pretos,,6000
Codo,Pov. Vergel/Vegel/Faz. Boa Esperanga,,1845
Codo,Comunidade Puraqué,,1250
Codo,Com. Quilombola Mata Virgem,,1200
Codo,Roque/Axixa,,4092
Codo,Faz. Manguinhos/Pov. Buriti Corrente/TG Agroindustria,,5400
Coelho Neto,Fazenda Brejinho,124,7038
Coroata,Data Santana/Com. Sao José do Lagao,,4000
Duque Bacelar,Comunidade Feitoria,,500
Formosa da Serra Negra,Pov. Bem Feito/Faz. Chapada do Bacuri/GI. Sao José/Data,,970
Godofredo Viana/ Candido Mendes,Com. Aurizona/Mineragao Aurizona,,600
Governador Nunes Freire,P. A. Maracagumé Mesbla,,8000
Grajau,Assentamento Remanso,,2500
Guimaraes,Com. Guajerutiua/Guajaretiua,,600
Itapecuru Mirim,T. Outros/Duplicagao Q. Sta. Rosa dos BR-135 Pretos/Barreira Funda/Alto Sao Joao e,,
Itapecuru Mirim,Mata de Sao Benedito |,,1000
Itapecuru Mirim,Sumatma,,2000
Itapecuru Mirim,Mata de Sao Benedito 2,,3100
Itapecuru Mirim,Com. Quilombola Colombo/Duplicagao BR-135,325,
Itinga do Maranhao,Acamp. Marielle Franco,152,9000
Joao Lisboa,Acamp. Mata Verde/P. A. Sao Joao/Pov. Centro do Toim,,
Joao Lisboa/ Amarante do Maranhdao/ Senador La,Faz. Cip6é Cortado/Rolete,140,4000
Junco do Maranhao,P. A. Florestal Maracagumé,80,11470
Junco do Maranhao/ Boa Vista do Gurupi/ Amapa,Com. Vilela/Gleba Campina,100,
Lago do Junco,Pov. Centro dos Aguiar/Faz. Nova Olinda,42,797
Luis Maracagumé/ Domingues Amapa do Maranhao,Gl. Gleba Campina/Faz. Negra Velha Santa Erica,100 50,4000 1000
Matinha,Territorio Sesmaria do Jardim/Quilombo Bom Jesus,58,2000
Matinha,Com. Quilombola Itapera,53,500
Matinha,Com. Quilombola Tanque do Valenga,130,1400
Matinha,Territorio Sesmaria do Jardim/Quilombo Sao Caetano,65,600
Matinha,Com. Quilombola Jacuica,50,322
Matinha,Com. Quilombola Sao José de Bruno,45,230
Matinha,Com. Quilombola Pregui¢ga Velha Contenda,600,1420
Matinha,Territorio Sesmaria do Jardim/Quilombo Pastos,107,
Matédes,Com. Tanque de Rodagem/Sao Joao/Faz. Castiga,50,1300
Montes Altos/ Amarante do Maranhao/ Lajeado No,T. |. Krikati,206,146000
Olinda Nova do Maranhao,Com. Quilombola Caldo Quente,87,561
Parnarama,Povoado Conceigao,,800
Parnarama,Com. Quilombola Cocalinho,152,3375
Parnarama,Pov. Guerreiro/Faz. Cana Brava/Suzano Papel Celulose,,9000
Pedro do Rosario,Santo Anténio,,1800
Pedro do Rosario/ Matinha,Com. Quilombola Imbiral/Cabecga Branca,,2000
Peritoré,Faz. Boa Esperanga/Modelo,,2341
Pindaré Mirim,Acampamento Novo Pindaré,250,1074
Presidente Sarney,Rio Fundo,,280
Primeira Cruz,PE Tronco/Buritizal/Troncho,,1600
Primeira Cruz,Faz. Sao Raimundo/Rosarinho,20,300
Rosario,Com. Quilombola Simatma,22,90
Santa Quitéria do Maranhao,Cabeceira da Tabatinga,,2936
Santa Quitéria do Maranhao,Pau Serrado,280,12000
Santa Rita,Com. Quilombola Cariongo/Duplicagao BR-135,,559
Santa Rita,Outeiro dos Pires/Vale,120,
Sao Benedito do Rio Preto,Sao Domingos,,1000
Sao Benedito do Rio Preto,Faz. Guarima/Data Cumbre,,400
Sao Benedito do Rio Preto,Bacuri,,900
Sao Benedito do Rio Preto,Povoado Bacabal,,140
Sao Benedito do Rio Preto,Comunidade Alegria do Raul,,2341
Sao Benedito do Rio Preto,Assent. Sao Luis/Picos,,1429
Sao Benedito do Rio Preto,Santa Maria/P. A. Anténio Marcos de Jesus,,4587
Sao Sao Benedito Benedito do do Rio Rio Preto Preto/ Belagua,Olho P. A. d'Agua Maria Rodrigues/Lagoa dos Diniz da Lucia,,2953 1181
Sao José de Ribamar,Com. Tremembé do Engenho,,77
Sao Luis,Comunidade Cajueiro,,610
Sao Luis,Tajipuru/Tagipuru dos Copos,,157
SAo Raimundo das Mangabeiras,Data Ipoeira,,14147
So Raimundo das Mangabeiras,Data Barra da Oncga,,186
Sao Vicente Ferrer,Com. Quilombola do Charco,,1280
Senador La Rocque,Acampamento Batata da Terra,,800
Timbiras,Faz. Campestre Catulo/Pov. Canafistula,,14402
Timbiras,Faz. Sao Raimundo/Data S40 Tomé,,5000
Tuntum,Pov. Baixaéo do Gato e Tamanquinho,,2500
Tuntum,Povo Krenyé,,8000
Turilandia,P. A. Santo Anténio/Rio Caxias,,5000
Urbano Santos,Com. Quilombola de Santa Maria/Faz. Lara/Fortaleza,,1000
Urbano Santos,Com. Santa Rosa/Bacabal,60,1549
Urbano Santos,Pov. Margal das Ongas,30,
Urbano Santos,Pov. Pedra Grande,45,
Urbano Santos,Comunidade Sao Raimundo,36,1400
Urbano Urbano Santos/ Santos/ Belagua Belagua,Jugaral Estiva do Cangati,30 8,680
Urbano Santos/ Cod6,Pov. Cajazeiras,250,
Viana,Pov. de Bahias/Santero/Povo Gamella,250,
Subtotal:,180,16154,989745
Barao de Melgaco,T. |. Baia dos Guat6/Guaté,50,
Brasnorte,T. |. lrantxe/Manoki,50,46790
Caceres,Faz. Rancho Verde/Acamp. Renascer,100,
Campo Novo dos Parecis,T. |. Utiariti/Aldeia Bacaval,102,
Campos de Julio/ Nova Lacerda,T.1. Uirapuru,7,21680
Colniza Chapada dos Guimaraes,Area Com.Tradicional/Ass. da Cooper-Roosevelt/P. N. Sra. Aparecida A Taquarucu do Norte,150 51,1500
Colniza,Faz. Bauru/Magali,374,48000
Comodoro/ Colniza,T. |. Kawahiva do Rio Pardo,17,411844
Confresa,P.A. Independente |,279,
Confresa/ Santa Terezinha,T. |. Urubu Branco/Tapirapé,146,
Diamantino/ Nova Marilandia/ Nova Maringa,T.I. Estagao Paresi/Ponte de Pedra/Faz. Sao Jorge,89,3620
Feliz Natal,Assentamento Ena,500,
Jaciara,Area da Prefeitura/Acamp. Pe. José Ten Cate,400,250
Jaciara,Fazenda Entre Rios,300,
Jaciara,Gl. Mestre I/Usina Pantanal/Acamp. Renascer,135,8900
Juina,Gleba Rio Verde/Fazenda Esmeralda,30,
Juruena,Faz. Rosahmar/Rohden,4,25100
Mirassol do Oeste,Acamp. Terra Esperanca,89,
Nova Xavantina/ Campinapolis,T. |. Parabubure/Xavante,955,224447
Novo Mundo,Gl. Nhandu/Faz. Belo Horizonte,90,6000
Novo Mundo,Faz. Arauna/Acamp. Nova Esperanga/GI. Nhandu,20,
Novo Mundo,Faz. Nossa Sra. da Abadia/Pouso Alegre/Antiga Faz. 5,96,
Paranatinga,PDS Rio Jatoba,190,10726
Peixoto de Azevedo,Fazenda Serra Dourada II,300,4100
Queréncia,P.A. Coutinho Uniao,170,15739
Santo Anténio do Leverger,T.I. Tereza Cristina,127,25694
Sao Félix do Araguaia/ Alto Boa Vista,T. |. Maraiwatsedé/Xavante/Faz. Suia-Missu,225,165000
Sapezal,T.I. Tirecatinga,44,130575
Sorriso,Fazenda Cagula,60,
Tabapora/ Apiacas/ Juara/ Nova Canaa do Norte,T. Kururuzinho//Muruvi/Dinossauro |. Batelao/Apiaca- Kayabi/Ald.,50,117000
Vila Tangara Rica da Serra,T.I. Area Rio Mutum Formoso,100 42,19749
Vila Rica,Fazenda Rancho da Mata Verde,52,2600
Vila Rica,Pontal do Areia,60,5765
Subtotal:,35,5454,1295079
Aquidauana,Faz. Capao das Araras/T. |. Taunay Ipegue,20,2482
Aral Moreira,Faz. Trés Poderes/T. |. Tekoha Guasu-Guaiviry-Jovy,50,
Caarapo,T. |. Guyraroka,32,11400
Caarapo,Com. Tey'i Jucu/Tey'i Jusu/Faz. Nossa Sra. Aparecida,30,
Caarapdo,T. Novilho/Nhandeva/T. |. Pindo Roky/Itagua/Retomada |. Dourados Amambai das Maes/Faz. Pegua,150,
Caarapdo,Dourados Amambai Pegua Faz. Yvu/lvu/Tekoha Torapaso/Kunumi Poty Vera/T. |.,40,
Caarapdo,Faz. Santa Maria/Tekoha Toropaso/T. |. Dourados Amambai,24,
Campo Caarapo Caarap6/ Dois Irmaos Grande Aquidauana do Buriti,Area Acamp. Faz. Pegua Nhamoi Agua da Sebastiao Guaviray/Faz. JBS Branca/Jeroky Bilhar/Billar/BR-262 Agua Guasu Branca,200 150 20 30,3700
Dourados,Sitios Retomados/Imediagées das Aldeias Bororo e Jaguapiru,30,
Dourados,Serrana Com. Apyka'y/Acamp. na BR-463/Km 10/Proximo a Faz.,5,
Dourados,Acamp. Nhu Pora/Nhu Vera/Uvera/Campo Bonito/Curral de,45,
Iguatemi,Tekoha Mbaraka'y-Pyelito Kue/Guarani Kaiowa,20,
Itapora/ Douradina,T. |. Lagoa Rica/Guarani-Kaiowa,50,
Japora Japora,Area Porto em Lindo/lvy Japora - Katu/Guarani - Kaiowa,760 80,1700
Miranda,T. |. Pillad Rebua/Aldeia Moreira,100,208
Miranda,T. |. Pilad Rebua/Aldeia Passarinho,250,
Miranda,Aldeia Mae Terra/T. |. Cachoeirinha,24,
Mundo Novo,Area em Mundo Novo,120,
Nioaque,Acamp. as Margens da MS-419,250,
Nova Andradina,Fazenda Boarete,100,
Rio Brilhante,Faz. Sto. Ant6énio da Nova Esperanga/Com. Laranjeira,45,450
Sidrolandia,Acamp. Perto da Rede Ferroviaria do Brasil,130,15
Subtotal:,26,2755,19955
Acucena/ Belo Horizonte/ Carmésia,T. |. Patax6/Projeto Minas-Rio/Anglo American,150,
Anténio Carlos,Faz. da Serra/Acamp. Gabriel Pimenta,,4000
Anténio Carlos,Faz. Capao da Onga/Acamp. Gabriel Pimenta,,290
Bocaitiva/ Engenheiro Navarro,Faz. Santo Eloy/Garrote,,1400
Buritizeiro,Com. Vazanteira do Cérrego Canabrava/Faz. Canabrava,,5052
Campo do Meio,Faz. Ariadndpolis/Assent. Quilombo Campo Grande,,6000
Capitao Enéas,Faz. Norte América/Acamp. Alvimar Ribeiro,,
Conceigao do Mato Dentro,Com. Sebastiao do Bom Sucesso - Sapo/Proj. Minas-Rio/Anglo American,,
Conceigao do Mato Dentro,Com. Cabeceira do Turco/Projeto Minas-Rio/Anglo American,,
Conceigao do Mato Dentro,Com. do Turco/Projeto Minas-Rio/Anglo American,,
Conceigao do Mato Dentro,Familia Pimenta/Proj. Minas-Rio/Anglo American,,
Coronel Pacheco,Faz. Sao José/Liberdade/Acamp. Gabriel Pimenta/Reunidas,,2700
Francisco Sa,Faz. Redengao/Acamp. Alvimar Ribeiro,,
Grao Mogol,Cancelas Faz. Rio Rancho/Buriti Pequeno/Com. Geraizeiros do Vale das,,6434
Ibiai,Com. Extrativista Barra do Pacui e Pescadores Artesanais as,,
Igarapé,Faz. da Empresa MMX de Eike Batista,,
Itacarambi,Com. Vazanteira Barrinha/Rio Sao Francisco,,
Januaria,Com. Quil. Croata/Rio Sao Francisco,,541
Jequitai,Com. Barrocao Pau de Fruta/Buritis de Baixo,,
Manga/ Matias Cardoso,Com. da Ilha de Pau Preto/Rio Sao Francisco/Proj. Jaiba,,
Montes Claros,Fazenda Bom Jesus,,200
Nova Serrana,Faz. Canta Galo/Acamp. Nova Jerusalém,,
Padre Carvalho,Territ. Geraizeiro Curral de Varas II/Rio Rancho Agrop. S/A,,
Pedras Presidente de Maria Olegario da Cruz,Area Com. no Quil. Distrito Caraibas/Faz. de Galena/Indigenas Pedra de Sao Xucuru Joao Karir Agrop.,,
Riacho dos Machados,Carpathian Gold Com. Riacho dos Machados/margens do Sao Francisco/Min.,,
Sao Joaquim de Bicas,Complexo de Fazs. de Eike Batista,,700
Uberaba,Faz. Pao de Queijo/Acamp. 19 de Margo,,
Vazante,Faz. Veredinha/Acamp. José Beraldo,,
Subtotal:,40,,27317
Acara/ Tomé-Acgu,Com. Quil. Alto Acara/Biovale,,4300
Afua,Cajueiro/PAE Ilha dos Caras**,,1000
Alenquer,Fazenda Laguinho,,1615
Almeirim/ Monte Dourado,Projeto Jari Celulose/Jarcel,100,
Altamira/ Senador José Porfirio,T.I. Ituna/Itata,,142000
Ananindeua,Com. Quilombola do Abacatal,121,864
Anapu,Gl. Belo Monte/PDS Virola Jatoba/Dorothy,160,39385
Anapu,Gl. Bacaja/Lote 46/ Faz. Sta. Luzia,48,
Anapu,Gleba Bacaja/PDS Esperanga/Assassinato da Ir. Dorothy,178,
Anapu/ Senador José Porfirio/ Vitoria do Xingu,T. |. Paquigamba/Juruna/UHE Belo Monte/PAC,24,
Baiao,Resex Ipau/Anilzinho,100,
Bom Jesus do Tocantins,Fazenda Gaucha,300,
Bom Jesus do Tocantins,Faz. Goiana/Aras Sta. Elias,200,4356
Bom Jesus do Tocantins,Fazenda Mococa,,968
Breu Branco,Fazenda Chama/Acampamento Irma Dorothy,31,1219
Cachoeira do Arari,Com. Quil. de Gurupa,200,12852
Canaa dos Carajas,Acamp. Carajas/Vale/Projeto Serra Dourada/Complexo S11D Sao Luis/P. A.,300,
Canaa Canaa dos dos Carajas Carajas,"Acamp. P. A. Carajas Rio Sossego/Area I, Il, Ill/ Proj. Mineragao da Vale Sossego/CVRD",300 54,
Canaa dos Carajas,Acamp. Carajas/Vale/Projeto Grotao do Mutum/Complexo S11D Sao Luis/P. A.,350,4120384
Canaa dos Carajas,Acamp. Alto da Serra/Parte da Faz. Cristalino,80,
Canaa dos Carajas,Acamp. Luis/P. A. Eduardo Carajas/Vale Galeano/Retiro do Zequinha/Comp. Sao,200,
Curiondpolis,Acamp. Uniao do Axixa/Parte da Faz. Cristalino,200,
Curiondpolis/ Parauapebas/ Maraba,Faz. Marambaia/Fazendinha/Colorado/Acamp. Frei Henri,120,15000
Eldorado dos Carajas/ Irituia,Agrop. Sta. Barbara/M? Bonita/Compl. Faz. Sao Felipe,212,23000
Goianésia Ipixuna Itaituba do do Para Para,Faz. Reserva Fazenda Triangulo/Acamp. Indigena Campo de Praia Boi Nova | do e Mangue II Esperanga,500 42 75,19973 31
Itaituba,Com. Mangabal e Montanha/PCH's Tapajés,101,
Itaituba/ Altamira/ Novo Progresso,Faz. Atalas/Tigre/Castelo dos Sonhos/PDS Brasilia,350,55000
Itaituba/ Trairao,T. |. Sun Sawré Muybu/Munduruku/PCHs Tapajés/Mineradora Belo,170,178000
Itupiranga,Fazenda Cristalina,100,2376
Jacareacanga,T. |. Munduruku/UHE Tapajés/Mineradora Belo Sun/PAC,1630,
Maraba,Complexo da Faz. Trés Poderes/Agrop. Sta. Barbara,300,11835
Maraba,Fazenda Piranheira/Vale,150,16623
Maraba,Chavez Faz. Santa Tereza/Acamp. Santa Ernestina/Acamp. Hugo,450,1258
Maraba,Faz. Santa Clara/Acamp. Boa Esperanga,168,
Moju,Quil. de Jambu-Agu/Vale do Rio Doce,788,
Monte Alegre/ Santarém,PAE Lago Grande/Com. Aldeia/Jacarecapa/Passagem e,8500,250000
Novo Progresso,PDS Terra Nossa e Riozinho,1000,
Obidos Novo Repartimento/ Baiao,T. Faz. 1. Zo'é Petrdpolis/Gleba12,50 75,668565 3000
Ourilandia do Norte,Fazenda Mil e Duzentos,226,3000
Ourilandia do Norte,P. A. Tucuma/Campos Altos/Proj. Onga Puma/Vale,247,
Paragominas/ Santa Luzia do Para/ Garrafao do N,T.I. Alto Rio Guama/Tembé,300,279000
Parauapebas,Fazenda Santa Clara,70,3500
Pau d Arco,Faz. Santa Lucia/Acamp. Nova Vida/Jane Julia,200,5662
Placas,PDS Avelino Ribeiro,237,
Placas,PDS Arthur Faleiro,237,26164
Placas,PDS Castanheira,126,26164
Redengao,Faz. Santo Amaro/Acamp. Bom Sucesso,92,454
Salvaterra,Com. Quilombola Boa Vista,42,
Salvaterra,Com. Quilombola Bacabal,54,516
Santa Isabel do Para,Granja Kitagawa/Acamp. 13 de Agosto,27,
Santa Maria das Barreiras,Faz. Pontal/Acamp. Lagoa Azul,70,
Santana do Araguaia,Fazenda Ouro Verde,120,4500
Santana do Araguaia,Parte da Faz. Vale do Rio Cristalino/Agrop. Sta. Barbara,100,
Santana do Araguaia/ Cumaru do Norte,Faz. Estrela de Maceié/Acamp. Cangaia-Brilhante,400,
Santarém,T. |. Maro,60,42000
Santarém,PAE Eixo Forte,1386,12689
Santarém,T. |. Munduruku/Planalto Santareno,150,
Santarém,Com. Quilombola Tiningu,86,
Santarém/ Prainha,Gl. Pacoval/Corta-Corda/Raisan/PDS Sta. Clara/PAE Curua II,460,24000
Sao Domingos do Araguaia,Com. de Quebradeiras de Coco de Sao Domingos do Araguaia,,
Sao Félix do Xingu,Complexo Divino Pai Eterno/Acamp. Novo Oeste,220,8000
Sao Félix do Xingu,Assent. Belauto/Faz. Jaguara,300,
SAo Félix do Xingu/ Altamira,T. |. Apyterena/Apyterewa/Parakana,176,773000
Sao Félix do Xingu/ Tucuma/ Cumaru do Norte/ Ou,T. |. Kayapo,907,3284005
Sao Joao do Araguaia,Faz. Esperantina/Sidenorte,10,
Sao Jodo do Araguaia,Com. de Quebradeiras de Coco de Sao Joao do Araguaia,,
Sao Joao do Araguaia,Fazenda Landi,,1800
Senador José Porfirio,Gl. Bacajai/T. |. Arara da Volta Grande do Xingu,,25500
Tomé-Acu,T. |. Tembé/Turé-Mariquita,,147
